{
  "id": "entry-1735283456789-a1b2c3d4e",
  "timestamp": "2024-12-27T10:15:30.123Z",
  "actionMetadata": {
    "action": "create_new_branch",
    "actor": {
      "type": "human",
      "identifier": "sarah_developer",
      "experience_level": "intermediate"
    },
    "duration": 45000,
    "attempts": 2
  },
  "intentSnapshot": {
    "primary_goal": "Create a feature branch for implementing user authentication",
    "secondary_goals": [
      "Follow team naming conventions",
      "Ensure clean separation from main branch"
    ],
    "context": "Working on sprint ticket AUTH-123 to add OAuth integration to the application",
    "urgency_level": "medium"
  },
  "environmentalContext": {
    "system_state": {
      "cpu_usage": 23.5,
      "memory_usage": 67.2,
      "active_processes": 142
    },
    "network_conditions": {
      "connection_type": "wifi",
      "latency": 45.3,
      "bandwidth": 850.2
    },
    "external_variables": {
      "time_of_day": "10:15:30",
      "day_of_week": "Friday",
      "concurrent_users": 12,
      "system_load": "low"
    }
  },
  "emotionalCues": {
    "frustration_signals": [
      "repeated_attempts"
    ],
    "confidence_markers": {
      "level": "medium",
      "indicators": [
        "steady_progress",
        "deliberate_actions"
      ]
    },
    "emotional_state": "focused",
    "stress_indicators": []
  },
  "decisionRationale": {
    "reasoning": "Chose to create branch from latest main to ensure all recent changes are included. Used feature/ prefix as per team conventions.",
    "alternatives_considered": [
      {
        "option": "Create branch from previous stable release",
        "pros": [
          "Lower risk of conflicts",
          "Known stable base"
        ],
        "cons": [
          "Missing recent improvements",
          "Would require additional merging later"
        ],
        "rejection_reason": "Team policy requires feature branches from main"
      },
      {
        "option": "Work directly on main branch",
        "pros": [
          "No branch management overhead",
          "Immediate integration"
        ],
        "cons": [
          "Violates team workflow",
          "Risk of breaking main branch",
          "No isolation for testing"
        ],
        "rejection_reason": "Against established team practices and CI/CD pipeline"
      }
    ],
    "influencing_factors": [
      "Team workflow guidelines",
      "Sprint deadline pressure",
      "Previous experience with similar features"
    ],
    "confidence_in_decision": 0.85
  },
  "outcomeReflection": {
    "success_metrics": {
      "goal_achieved": true,
      "efficiency": 0.75,
      "quality": 0.90,
      "user_satisfaction": 0.80
    },
    "what_worked": [
      "Following established naming conventions saved time",
      "Checking out latest main first prevented conflicts",
      "Using git command line interface provided precise control"
    ],
    "what_didnt_work": [
      "Initial branch name didn't follow exact convention (missing ticket number)",
      "Forgot to push branch initially, causing confusion with team"
    ],
    "lessons_learned": [
      {
        "lesson": "Always include ticket number in branch name for better traceability",
        "applicability": "general",
        "confidence": 0.9
      },
      {
        "lesson": "Push new branch immediately after creation to make it visible to team",
        "applicability": "specific",
        "confidence": 0.8
      },
      {
        "lesson": "Double-check branch naming convention before finalizing",
        "applicability": "general",
        "confidence": 0.85
      }
    ],
    "recommendations": [
      "Create branch naming template or script to reduce errors",
      "Set up git hooks to remind about pushing new branches",
      "Document branch naming conventions in team wiki"
    ],
    "emotional_impact": {
      "immediate": "satisfied",
      "long_term": "learning-focused"
    }
  },
  "relationships": {
    "parent_entries": [],
    "related_entries": [
      "entry-1735283400000-xyz789abc"
    ],
    "subsequent_entries": []
  },
  "metadata": {
    "version": "1.0.0",
    "tags": [
      "experience",
      "git",
      "branching",
      "development_workflow",
      "team_collaboration"
    ],
    "privacy_level": "internal",
    "retention_policy": "standard"
  }
}